{
  "schema_version": "1.0.0",
  "report_id": "001309_2025-10-28",
  "source_id": "src_001309_2025-10-28",
  "presentation_metadata": {
    "company": "德明利",
    "company_name": "德明利",
    "stock_code": "001309",
    "industry": "",
    "report_title": "德明利（001309）深度研究报告",
    "report_date": "2025-10-28",
    "source_file": "001309_2025-10-28.md"
  },
  "sections": [
    {
      "section_ref": "sec-001",
      "section_title": "德明利（001309）深度研究报告",
      "summary": "该报告为德明利深度研究，标题层级最高。",
      "claims": [],
      "native_figures": []
    },
    {
      "section_ref": "sec-002",
      "section_title": "自研主控驱动跃迁，存储周期与产品放量共振",
      "summary": "阐述核心投资逻辑：自研主控构筑壁垒，NAND Flash周期反转叠加AI需求，公司业绩高增，维持买入评级。",
      "claims": [
        {
          "claim_id": "claim_sec002_01",
          "text": "公司已积累9颗自研主控芯片，覆盖移动存储与SATA SSD，并加速向PCIe SSD、嵌入式及企业级存储拓展。",
          "evidence_refs": [
            {
              "kind": "block",
              "id": "block_0004"
            }
          ]
        },
        {
          "claim_id": "claim_sec002_02",
          "text": "2025年Q3单季营收25.5亿元（同比+79.47%），净利润9087万元（同比+166.80%）。",
          "evidence_refs": [
            {
              "kind": "block",
              "id": "block_0006"
            }
          ]
        },
        {
          "claim_id": "claim_sec002_03",
          "text": "预计2024-2026年归母净利润分别为3.97/6.57/10.08亿元，对应增速1489%/65%/53%。",
          "evidence_refs": [
            {
              "kind": "block",
              "id": "block_0006"
            }
          ]
        },
        {
          "claim_id": "claim_sec002_04",
          "text": "维持“买入”评级，基于2026年预期EPS 6.23元，当前股价对应16.64倍PE。",
          "evidence_refs": [
            {
              "kind": "block",
              "id": "block_0007"
            }
          ]
        },
        {
          "claim_id": "claim_sec002_05",
          "text": "公司已成功研发并量产8款闪存主控芯片，主控工艺制程突破至22nm及以下。",
          "evidence_refs": [
            {
              "kind": "block",
              "id": "block_0010"
            }
          ]
        },
        {
          "claim_id": "claim_sec002_06",
          "text": "企业级存储产品已通过多家客户验证并实现小批量销售。",
          "evidence_refs": [
            {
              "kind": "block",
              "id": "block_0011"
            }
          ]
        },
        {
          "claim_id": "claim_sec002_07",
          "text": "内存条完成DDR5及LPCAMM2等全系列布局，成为营收增长新引擎。",
          "evidence_refs": [
            {
              "kind": "block",
              "id": "block_0012"
            }
          ]
        }
      ],
      "native_figures": []
    },
    {
      "section_ref": "sec-003",
      "section_title": "公司介绍:主控芯片+模组双轮驱动",
      "summary": "介绍公司双轮驱动模式，为后续详细分析铺垫。",
      "claims": [],
      "native_figures": []
    },
    {
      "section_ref": "sec-004",
      "section_title": "自研主控芯片构筑核心壁垒，四大产品线协同打开成长空间",
      "summary": "阐述公司以自研主控芯片为基础，构建四大产品线，形成独特竞争壁垒。",
      "claims": [
        {
          "claim_id": "claim_sec004_01",
          "text": "公司已自主研发9颗主控芯片，产品覆盖数据中心、AI、车载电子等领域。",
          "evidence_refs": [
            {
              "kind": "block",
              "id": "block_0015"
            }
          ]
        },
        {
          "claim_id": "claim_sec004_02",
          "text": "形成移动存储、固态硬盘、嵌入式存储和内存条四大产品线。",
          "evidence_refs": [
            {
              "kind": "block",
              "id": "block_0016"
            }
          ]
        }
      ],
      "native_figures": []
    },
    {
      "section_ref": "sec-005",
      "section_title": "实际控制人高比例持股，治理结构稳定支撑长期战略执行",
      "summary": "分析股权结构，实际控制人李虎及配偶田华持股比例高，治理结构稳定。",
      "claims": [
        {
          "claim_id": "claim_sec005_01",
          "text": "截至2025年6月30日，总股本16,177.27万股，李虎直接持有36.91%。",
          "evidence_refs": [
            {
              "kind": "block",
              "id": "block_0019"
            }
          ]
        },
        {
          "claim_id": "claim_sec005_02",
          "text": "前四大股东合计持股约47.61%，李虎一人持股超后三大股东之和。",
          "evidence_refs": [
            {
              "kind": "block",
              "id": "block_0020"
            }
          ]
        }
      ],
      "native_figures": []
    },
    {
      "section_ref": "sec-006",
      "section_title": "从闪存主控到全栈存储：德明利“主控+模组”双轮驱动的成长路径与投资逻辑",
      "summary": "回顾公司发展历程，从主控芯片自研到全栈存储解决方案的进化路径。",
      "claims": [
        {
          "claim_id": "claim_sec006_01",
          "text": "公司2019年营收6.46亿元，2023年17.76亿元，CAGR达29%；2024年前三季度营收35.97亿元，同比增长268%。",
          "evidence_refs": [
            {
              "kind": "block",
              "id": "block_0028"
            }
          ]
        },
        {
          "claim_id": "claim_sec006_02",
          "text": "2023年募投项目合计投资近12亿元，其中PCIe SSD项目投资约4.99亿元，嵌入式项目投资约6.67亿元。",
          "evidence_refs": [
            {
              "kind": "block",
              "id": "block_0027"
            }
          ]
        }
      ],
      "native_figures": []
    },
    {
      "section_ref": "sec-007",
      "section_title": "自研主控构筑护城河，全品类存储模组卡位AI与国产化双主线",
      "summary": "详述自研主控芯片的技术优势，以及全品类产品矩阵如何卡位AI与国产化。",
      "claims": [
        {
          "claim_id": "claim_sec007_01",
          "text": "公司存储管理解决方案支持三星、铠侠、西部数据/闪迪、海力士、长江存储等多家原厂产品。",
          "evidence_refs": [
            {
              "kind": "block",
              "id": "block_0033"
            }
          ]
        },
        {
          "claim_id": "claim_sec007_02",
          "text": "公司已量产8款闪存主控芯片，主控制程突破至22nm及以下。",
          "evidence_refs": [
            {
              "kind": "block",
              "id": "block_0033"
            }
          ]
        },
        {
          "claim_id": "claim_sec007_03",
          "text": "2024年全球AI服务器出货量同比增长46%，预计2026年达237万台。",
          "evidence_refs": [
            {
              "kind": "block",
              "id": "block_0034"
            }
          ]
        },
        {
          "claim_id": "claim_sec007_04",
          "text": "PCIe SSD项目总投资由4.99亿元增至7.43亿元，企业级存储方案实现规模化出货。",
          "evidence_refs": [
            {
              "kind": "block",
              "id": "block_0034"
            }
          ]
        },
        {
          "claim_id": "claim_sec007_05",
          "text": "嵌入式eMMC产品覆盖车规、工规和商规市场，UFS产品规划256GB至1TB容量区间并批量出货。",
          "evidence_refs": [
            {
              "kind": "block",
              "id": "block_0035"
            }
          ]
        },
        {
          "claim_id": "claim_sec007_06",
          "text": "内存条产品线覆盖DDR3至DDR5全系列，AI PC用DDR5模组单条容量最高48GB，带宽32GB/s。",
          "evidence_refs": [
            {
              "kind": "block",
              "id": "block_0035"
            }
          ]
        }
      ],
      "native_figures": []
    },
    {
      "section_ref": "sec-008",
      "section_title": "自研主控+晶圆直采：公司构筑存储模组差异化竞争壁垒",
      "summary": "分析公司通过自研主控和晶圆直采构建的差异化竞争壁垒。",
      "claims": [
        {
          "claim_id": "claim_sec008_01",
          "text": "2023年三星、SK海力士等五家原厂合计占据全球约94.8%市场份额。",
          "evidence_refs": [
            {
              "kind": "block",
              "id": "block_0037"
            }
          ]
        },
        {
          "claim_id": "claim_sec008_02",
          "text": "2025年2月，新一代自研SD6.0存储卡主控芯片（40nm工艺）成功量产。",
          "evidence_refs": [
            {
              "kind": "block",
              "id": "block_0038"
            }
          ]
        },
        {
          "claim_id": "claim_sec008_03",
          "text": "存储卡/盘模组中，晶圆测试逐渐由自有产线完成，封装测试委外；固态硬盘自2020年后主要通过自有产线完成。",
          "evidence_refs": [
            {
              "kind": "block",
              "id": "block_0039"
            }
          ]
        }
      ],
      "native_figures": []
    },
    {
      "section_ref": "sec-009",
      "section_title": "财务与经营分析",
      "summary": "涵盖财务与经营分析，为后续子章节提供总览。",
      "claims": [],
      "native_figures": []
    },
    {
      "section_ref": "sec-010",
      "section_title": "产品结构重塑：嵌入式存储与固态硬盘双轮驱动，成长型品类占比逼近50%",
      "summary": "分析产品结构变化，嵌入式存储跃居第一大品类，固态硬盘稳中有升，内存条成为新增长极。",
      "claims": [
        {
          "claim_id": "claim_sec010_01",
          "text": "2025H1嵌入式存储营收17.00亿元，同比增约290%，占比41.37%，成为第一大营收来源。",
          "evidence_refs": [
            {
              "kind": "block",
              "id": "block_0043"
            }
          ]
        },
        {
          "claim_id": "claim_sec010_02",
          "text": "2025H1固态硬盘营收15.34亿元，同比增长64.6%，占比37.34%。",
          "evidence_refs": [
            {
              "kind": "block",
              "id": "block_0044"
            }
          ]
        },
        {
          "claim_id": "claim_sec010_03",
          "text": "2025H1内存条实现营收3.38亿元，占比8.22%。",
          "evidence_refs": [
            {
              "kind": "block",
              "id": "block_0045"
            }
          ]
        },
        {
          "claim_id": "claim_sec010_04",
          "text": "传统移动存储营收从2023年10.35亿元降至2025H1的5.37亿元，占比从58.3%降至13.06%。",
          "evidence_refs": [
            {
              "kind": "block",
              "id": "block_0044"
            }
          ]
        }
      ],
      "native_figures": []
    },
    {
      "section_ref": "sec-011",
      "section_title": "毛利率深度共振存储周期，战略备货放大波动，费用管控构筑护城河",
      "summary": "分析毛利率与存储周期共振，存货规模激增放大波动，但费用率管控突出。",
      "claims": [
        {
          "claim_id": "claim_sec011_01",
          "text": "公司毛利率从2020年22.63%降至2023年16.67%，2024年回升至17.77%，2025年降至14.81%。",
          "evidence_refs": [
            {
              "kind": "block",
              "id": "block_0049"
            }
          ]
        },
        {
          "claim_id": "claim_sec011_02",
          "text": "存货从2019年末2.87亿元激增至2025年末70.58亿元。",
          "evidence_refs": [
            {
              "kind": "block",
              "id": "block_0050"
            }
          ]
        },
        {
          "claim_id": "claim_sec011_03",
          "text": "2024年销售费用率0.85%，远低于江波龙4.42%和佰维存储3.79%。",
          "evidence_refs": [
            {
              "kind": "block",